{
  "schema": 1,
  "revision": 1,
  "id": "assistant",
  "title": "Asistente de trabajo",
  "brightness": 85,
  "sounds": true,
  "breath_hz": 0.23,
  "fur": 15391686,
  "patch": 5323043,
  "eyes": 7978216,
  "widgets": [
    {
      "id": "main",
      "type": "text",
      "label": "Asistente de trabajo",
      "x": 16,
      "y": 80,
      "w": 288,
      "h": 140,
      "page": "home"
    }
  ]
}
