{
  "schema": 1,
  "revision": 1,
  "id": "my_sagwa",
  "base": "pet",
  "title": "Mi Sagwa",
  "brightness": 85,
  "sounds": true,
  "breath_hz": 0.23,
  "widgets": [
    {
      "id": "response",
      "type": "text",
      "label": "Estoy aquí contigo.",
      "x": 16,
      "y": 156,
      "w": 288,
      "h": 64,
      "page": "home"
    },
    {
      "id": "note",
      "type": "text",
      "label": "Mi pantalla secundaria",
      "x": 16,
      "y": 44,
      "w": 288,
      "h": 160,
      "page": "notas"
    }
  ]
}
