{
  "schema": 1,
  "revision": 1,
  "id": "night",
  "title": "Noche",
  "brightness": 12,
  "sounds": false,
  "breath_hz": 0.12,
  "fur": 15391686,
  "patch": 5323043,
  "eyes": 7978216,
  "widgets": [
    {
      "id": "main",
      "type": "status",
      "label": "Noche",
      "x": 16,
      "y": 156,
      "w": 288,
      "h": 64,
      "page": "home"
    }
  ]
}
